"","web_url","snippet","lead_paragraph","print_page","source","pub_date","document_type","news_desk","section_name","subsectoinName","type_of_material","_id","word_count","score","uri","headline.main","headline.kicker","headline.content_kicker","headline.print_headline","headline.name","headline.seo","headline.sub","byline.original","byline.organization"
"110","https://www.nytimes.com/2019/03/19/business/economy/what-is-crane-index.html","To help its clients assess hiring trends, a construction consulting firm created a crane index, which also provides a snapshot of the economy.","To help its clients assess hiring trends, a construction consulting firm created a crane index, which also provides a snapshot of the economy.","6","The New York Times","2019-03-19T22:17:04+0000","article","Business","Business","Economy","News","5c916aba49f0eacbf105df27",1253,0,"nyt://article/fe4f3d17-95f5-5b06-98e2-3194c4c8f201","Another Role for Construction Cranes: Economic Indicator","Square Feet","Square Feet","How’s the Economy? Count the Cranes to Find Out",NA,NA,NA,"By C. J. HUGHES",NA
"111","https://www.nytimes.com/2019/03/19/business/faa-stephen-dickson-trump.html","Mr. Dickson will be nominated amid calls for the aviation agency to explain its approval of the Boeing 737 Max, the jet involved in the two accidents","Mr. Dickson will be nominated amid calls for the aviation agency to explain its approval of the Boeing 737 Max, the jet involved in the two accidents","8","The New York Times","2019-03-19T20:37:15+0000","article","Business","Business",NA,"News","5c91535549f0eacbf105deda",470,0,"nyt://article/5ffd1025-c915-5c74-8226-d64e8c5424e6","Trump Picks Former Delta Executive Stephen Dickson as F.A.A. Chief",NA,NA,"Trump Picks Delta Veteran To Supervise Flight Agency",NA,NA,NA,"By TIFFANY HSU, THOMAS KAPLAN and ZACH WICHTER",NA
"112","https://www.nytimes.com/2019/03/19/briefing/new-zealand-deutsche-bank-japan-your-wednesday-briefing.html","Let us help you start your day.","Let us help you start your day.",NA,"The New York Times","2019-03-19T19:09:35+0000","article","NYTNow","Briefing",NA,"briefing","5c913ec949f0eacbf105de95",1386,0,"nyt://article/63b2ba5f-c5ef-5628-8433-9f886806bc4c","New Zealand, Deutsche Bank, Japan: Your Wednesday Briefing",NA,NA,"New Zealand, Deutsche Bank, Japan: Your Wednesday Briefing",NA,NA,NA,"By ALISHA HARIDASANI GUPTA",NA
"113","https://www.nytimes.com/2019/03/19/technology/facebook-discrimination-ads.html","The social media giant will stop allowing advertising of housing, jobs or credit to be aimed at those of a certain race, gender or age group.","The social media giant will stop allowing advertising of housing, jobs or credit to be aimed at those of a certain race, gender or age group.","1","The New York Times","2019-03-19T18:00:04+0000","article","Business","Technology",NA,"News","5c912e7e49f0eacbf105de5a",1394,0,"nyt://article/aa4c5b0b-25b5-5a9e-acd8-c0b4d869563f","Facebook Halts Ad Targeting Cited in Bias Complaints",NA,NA,"Ad Practices Tied to Bias Are Banned By Facebook",NA,NA,NA,"By NOAM SCHEIBER and MIKE ISAAC",NA
"114","https://www.nytimes.com/2019/03/19/reader-center/new-zealand-media-coverage.html","The killing of 50 people in New Zealand last week seems to be the most extreme example of a mass shooter using the internet as part of his arsenal of destruction and hate. We look at how this affected our calculations around how to cover the attac...","The killing of 50 people in New Zealand last week seems to be the most extreme example of a mass shooter using the internet as part of his arsenal of destruction and hate. We look at how this affected our calculations around how to cover the attack.","2","The New York Times","2019-03-19T21:30:10+0000","article","NewsDesk","Reader Center",NA,"News","5c915fbc49f0eacbf105def6",1616,0,"nyt://article/86b344c7-3673-5ee7-8797-35c110e724c8","The New Zealand Attack Posed New Challenges for Journalists. Here Are the Decisions The Times Made.",NA,NA,"Covering the New Zealand Attack",NA,NA,NA,"By HANNA INGBER",NA
"115","https://www.nytimes.com/2019/03/19/world/middleeast/isis-truffle-iraq.html","The militants are targeting Iraqis who venture into the wild to search for the delicacy, demanding ransom for those they don’t simply kill.","The militants are targeting Iraqis who venture into the wild to search for the delicacy, demanding ransom for those they don’t simply kill.","4","The New York Times","2019-03-19T09:00:14+0000","article","Foreign","World","Middle East","News","5c90aff949f0eacbf105dcd4",1432,0,"nyt://article/00381fb7-34fe-51d1-934b-730c98066df4","They Go to the Desert to Hunt for Truffles. But ISIS Is Hunting Them.",NA,NA,"Hunting for Desert Truffles, and Becoming Prey for ISIS",NA,NA,NA,"By ALISSA J. RUBIN",NA
"116","https://www.nytimes.com/2019/03/19/nyregion/sexual-harassment-neutral-reference.html","For city workers ousted over sexual harassment charges, “neutral reference agreements” help them hide bad behavior from prospective employers.","For city workers ousted over sexual harassment charges, “neutral reference agreements” help them hide bad behavior from prospective employers.","24","The New York Times","2019-03-19T09:00:07+0000","article","Metro","New York",NA,"News","5c90aff149f0eacbf105dcca",1436,0,"nyt://article/ccc08f0c-a563-5e70-9ac1-fc9c0dc65560","They Were Accused of Sexual Harassment, but the City Hid It",NA,NA,"Sexual Harassment Claims Led to Their Ouster, but City Kept Mum",NA,NA,NA,"By WILLIAM NEUMAN",NA
"117","https://www.nytimes.com/2019/03/20/briefing/federal-reserve-disney-kazakhstan.html","Here’s what you need to know.","Here’s what you need to know.",NA,"The New York Times","2019-03-20T09:39:45+0000","article","NYTNow","Briefing",NA,"briefing","5c920abb49f0eacbf105e06c",1510,0,"nyt://article/7ff14abe-026f-5035-9665-9d2e0111f30d","Federal Reserve, Disney, Kazakhstan: Your Wednesday Briefing",NA,NA,"Federal Reserve, Disney, Kazakhstan: Your Wednesday Briefing",NA,NA,NA,"By CHRIS STANFORD",NA
"118","https://www.nytimes.com/2019/03/19/business/dealbook/trump-deutsche-bank.html","The German lender courted Mr. Trump when no one else would, gave him millions — and has dropped him more than once.","The German lender courted Mr. Trump when no one else would, gave him millions — and has dropped him more than once.",NA,"The New York Times","2019-03-19T10:58:17+0000","article","Business","Business","DealBook","News","5c90cba349f0eacbf105dd30",1997,0,"nyt://article/0b906b5e-597a-5493-86a8-b7831cee3281","DealBook Briefing: Inside Trump and Deutsche Bank’s Checkered History",NA,NA,"DealBook Briefing: Inside Trump and Deutsche Bank’s Checkered History",NA,NA,NA,NA,NA
"119","https://www.nytimes.com/2019/03/20/t-magazine/postmodern-dance.html","The movement upended all notions of what the form could be. Today, it’s still shaping how we see the world around us.","The movement upended all notions of what the form could be. Today, it’s still shaping how we see the world around us.",NA,"The New York Times","2019-03-20T09:00:09+0000","article","TStyle","T Magazine",NA,"News","5c92017449f0eacbf105e047",2450,0,"nyt://article/42c1f81c-c4b1-57ee-a9f6-9a32519a38c1","The Pioneers of Postmodern Dance, 60 Years Later","Social Studies","Social Studies","The Pioneers of Postmodern Dance, 60 Years Later",NA,NA,NA,"By KATE GUADAGNINO",NA
"120","https://www.nytimes.com/2019/03/19/t-magazine/chile-architecture.html","Immense and indomitable, the country’s dramatic topography and climate have produced unique and spectacular takes on Modernist architecture.","Immense and indomitable, the country’s dramatic topography and climate have produced unique and spectacular takes on Modernist architecture.",NA,"The New York Times","2019-03-19T09:00:17+0000","article","TStyle","T Magazine",NA,"News","5c90affb49f0eacbf105dcd5",3678,0,"nyt://article/70187c73-c7b3-5a7f-b8c4-4fdc0ddaa5d3","In Chile, Homes as Extreme as the Landscape Itself",NA,NA,"In Chile, Homes as Extreme as the Landscape Itself",NA,NA,NA,"By MICHAEL SNYDER",NA
