"","web_url","snippet","lead_paragraph","print_page","source","pub_date","document_type","news_desk","section_name","subsectoinName","type_of_material","_id","word_count","score","uri","headline.main","headline.kicker","headline.content_kicker","headline.print_headline","headline.name","headline.seo","headline.sub","byline.original","byline.organization"
"73","https://www.nytimes.com/2019/03/19/world/europe/uk-water-shortage.html","Climate change and population growth, meaning less supply and more demand, could equal an “existential threat,” England’s environment chief warned.","Climate change and population growth, meaning less supply and more demand, could equal an “existential threat,” England’s environment chief warned.","6","The New York Times","2019-03-19T16:03:08+0000","article","Foreign","World","Europe","News","5c91131649f0eacbf105dded",682,0,"nyt://article/505eb2ce-e91a-5e34-9f3c-85b4734d9ca4","Britain (Yes, Rainy Britain) Could Run Short of Water by 2050, Official Says",NA,NA,"For Britain, Water, Water Everywhere, Nor …",NA,NA,NA,"By ILIANA MAGRA",NA
"74","https://www.nytimes.com/2019/03/19/business/japan-olympics-bribery-corruption.html","Tsunekazu Takeda faces scrutiny in France over payments that prosecutors say were bribes to help Tokyo win hosting rights for the 2020 Summer Games.","Tsunekazu Takeda faces scrutiny in France over payments that prosecutors say were bribes to help Tokyo win hosting rights for the 2020 Summer Games.",NA,"The New York Times","2019-03-19T05:43:25+0000","article","Business","Business",NA,"News","5c9081d749f0eacbf105dc66",654,0,"nyt://article/8f7a285b-d9e2-53b4-80af-67f77a2f9a88","Japan’s Olympic Chief to Step Down Amid Corruption Investigation",NA,NA,"",NA,NA,NA,"By BEN DOOLEY",NA
"75","https://www.nytimes.com/2019/03/20/opinion/new-zealand-gun-control.html","Other nations’ leaders learn from experience. But Congress and President Trump refuse to act on guns.","Other nations’ leaders learn from experience. But Congress and President Trump refuse to act on guns.","27","The New York Times","2019-03-20T23:35:29+0000","article","OpEd","Opinion",NA,"Op-Ed","5c92ce9c49f0eacbf105e2ba",834,0,"nyt://article/26b12508-b9aa-5cf5-8247-e0d60aa58c17","New Zealand Shows the U.S. What Leadership Looks Like",NA,NA,"Will Politicians Ever Protect Us From Guns?",NA,NA,NA,"By NICHOLAS KRISTOF",NA
"76","https://www.nytimes.com/2019/03/19/opinion/jordan-middle-east.html","Changes beyond the control of the region’s leaders are spurring a new Middle East.","Changes beyond the control of the region’s leaders are spurring a new Middle East.","27","The New York Times","2019-03-19T22:30:09+0000","article","OpEd","Opinion",NA,"Op-Ed","5c916dcb49f0eacbf105df2e",1470,0,"nyt://article/f1f4f146-6471-5c9f-bf03-3de3f2f8caf4","Beware the Mideast’s Falling Pillars",NA,NA,"Beware  The Mideast’s Falling Pillars",NA,NA,NA,"By THOMAS L. FRIEDMAN",NA
"77","https://www.nytimes.com/2019/03/20/opinion/trump-deutsche-bank.html","What this country needs is a president who knows how to default.","What this country needs is a president who knows how to default.","27","The New York Times","2019-03-20T23:28:43+0000","article","OpEd","Opinion",NA,"Op-Ed","5c92cd0549f0eacbf105e2b9",940,0,"nyt://article/351914d8-b90f-5f9d-9af1-4d82e7280c70","Well, Socialism Couldn’t Give Us Trump",NA,NA,"Well, Socialism Couldn’t Give Us Trump",NA,NA,NA,"By GAIL COLLINS",NA
"78","https://www.nytimes.com/2019/03/20/arts/music/christian-scott-atunde-adjuah-ancestral-recall-review.html","The trumpeter’s bold new album, “Ancestral Recall,” offers the kind of slow-burning immersion that most of his recent records have only gestured at.","The trumpeter’s bold new album, “Ancestral Recall,” offers the kind of slow-burning immersion that most of his recent records have only gestured at.","5","The New York Times","2019-03-20T17:14:12+0000","article","Culture","Arts","Music","Review","5c92753e49f0eacbf105e1b8",712,0,"nyt://article/19e8a64a-eb8a-566f-ba79-d37ab68724b8","Christian Scott aTunde Adjuah Continues to Break New Ground","Album Review","Album Review","Combining Legacies and Pushing Boundaries",NA,NA,NA,"By GIOVANNI RUSSONELLO",NA
"79","https://www.nytimes.com/2019/03/20/world/asia/vietnam-turtle-embalmed.html","A turtle called Cu Rua, which many Vietnamese saw as a symbol of the country, has joined the elite club of icons embalmed and put on display by Communist regimes.","A turtle called Cu Rua, which many Vietnamese saw as a symbol of the country, has joined the elite club of icons embalmed and put on display by Communist regimes.","11","The New York Times","2019-03-20T10:09:04+0000","article","Foreign","World","Asia Pacific","News","5c92119a49f0eacbf105e089",748,0,"nyt://article/7b146297-3d7f-550a-ac33-27f14604c4be","Vietnam Embalms a Sacred Turtle, Lenin-Style",NA,NA,"360-Pound Turtle Gets  Eternal Life, in Plastic",NA,NA,NA,"By MIKE IVES",NA
"80","https://www.nytimes.com/2019/03/20/opinion/green-new-deal-carbon-taxes.html","There is a better way to reduce harmful emissions.","There is a better way to reduce harmful emissions.","27","The New York Times","2019-03-20T10:00:05+0000","article","OpEd","Opinion",NA,"Op-Ed","5c920f7f49f0eacbf105e07f",832,0,"nyt://article/37508850-1795-551c-8ad7-fd50bc8c403f","Yes, We Need a Green New Deal. Just Not the One Alexandria Ocasio-Cortez Is Offering.",NA,NA,"A Pragmatic Fix for the Climate Crisis",NA,NA,NA,"By STEVEN RATTNER",NA
"81","https://www.nytimes.com/2019/03/20/obituaries/bernard-krisher-dead.html","A former Newsweek reporter, he founded the country’s first English-language newspaper and, as a philanthropist, established a hospital and hundreds of schools.","A former Newsweek reporter, he founded the country’s first English-language newspaper and, as a philanthropist, established a hospital and hundreds of schools.","24","The New York Times","2019-03-20T06:23:12+0000","article","Obits","Obituaries",NA,"Obituary (Obit)","5c91dcaa49f0eacbf105dfeb",879,0,"nyt://article/893aea24-fb8b-5c70-8516-38286c8aa1f8","Bernard Krisher, Free Press Champion in Cambodia, Dies at 87",NA,NA,"Bernard Krisher, 87, Fixture Of Journalism in Cambodia",NA,NA,NA,"By SETH MYDANS",NA
"82","https://www.nytimes.com/2019/03/19/us/what-is-patriarchy.html","In their new book, “Why Does Patriarchy Persist,” Carol Gilligan and Naomi Snider explore the psychology that keeps men in positions of power.","In their new book, “Why Does Patriarchy Persist,” Carol Gilligan and Naomi Snider explore the psychology that keeps men in positions of power.",NA,"The New York Times","2019-03-19T21:21:13+0000","article","Gender","U.S.",NA,"News","5c915da349f0eacbf105def2",960,0,"nyt://article/90a9e94d-60d7-5fbe-b821-448226659bb0","How the Patriarchy Got in Our Heads",NA,NA,"How the Patriarchy Got in Our Heads",NA,NA,NA,"By MAYA SALAM",NA
"83","https://www.nytimes.com/2019/03/19/theater/review-after-michael-mckeever.html","A threatening text message with a homophobic epithet leads to catastrophe for two families in a new play by Michael McKeever.","A threatening text message with a homophobic epithet leads to catastrophe for two families in a new play by Michael McKeever.","5","The New York Times","2019-03-19T18:35:47+0000","article","Culture","Theater",NA,"Review","5c9136dd49f0eacbf105de83",944,0,"nyt://article/f8908901-f0d7-5738-8a71-06af7f502767","Review: Bullies and Victims Face Off in ‘After.’ But Who’s Who?",NA,NA,"Families Feud Over Bullying",NA,NA,NA,"By JESSE GREEN",NA
"84","https://www.nytimes.com/2019/03/19/travel/how-to-fly-a-budget-airline.html","Budget airlines often trade space and even basic amenities for crowded planes and cheaper tickets. With these four tips however, you can save some cash and even enjoy the trip.","Budget airlines often trade space and even basic amenities for crowded planes and cheaper tickets. With these four tips however, you can save some cash and even enjoy the trip.","2","The New York Times","2019-03-19T09:00:07+0000","article","Travel","Travel",NA,"News","5c90aff249f0eacbf105dccc",897,0,"nyt://article/67d37408-0646-51a7-bf0a-74d2fe98f2e6","4 Tips to Fly a Budget Airline Without Hassle","Travel Tips","Travel Tips","Budget Flying Made Easier",NA,NA,NA,"By KHUSHBU SHAH",NA
"85","https://www.nytimes.com/2019/03/19/opinion/facebook-antitrust-investigation.html","Why I am calling on the Federal Trade Commission to investigate Facebook for violating antitrust laws.","Why I am calling on the Federal Trade Commission to investigate Facebook for violating antitrust laws.",NA,"The New York Times","2019-03-19T10:00:04+0000","article","OpEd","Opinion",NA,"Op-Ed","5c90bdfd49f0eacbf105dd06",958,0,"nyt://article/5a70e6f2-7894-5afe-ab96-04d674de5abb","The Case for Investigating Facebook",NA,NA,"The Case for Investigating Facebook",NA,NA,NA,"By DAVID N. CICILLINE",NA
"86","https://www.nytimes.com/2019/03/18/opinion/facebook-youtube-mass-shootings.html","A killer determined to make terrorism go viral beat a system designed to keep the worst of the web out of sight.","A killer determined to make terrorism go viral beat a system designed to keep the worst of the web out of sight.","26","The New York Times","2019-03-19T00:16:28+0000","article","Editorial","Opinion",NA,"Editorial","5c90353749f0eacbf105dbf9",939,0,"nyt://article/1d1ec29c-d7ce-56a3-938d-7afa5debc351","The Attack That Broke the Net’s Safety Net",NA,NA,"How an Attack Broke the Net’s Safety Net",NA,NA,NA,"By THE EDITORIAL BOARD","THE EDITORIAL BOARD"
"87","https://www.nytimes.com/2019/03/20/world/middleeast/netanyahu-pompeo-golan.html","Prime Minister Benjamin Netanyahu raised the issue during a visit by Secretary of State Mike Pompeo, whose agency no longer says the territory is “occupied.”","Prime Minister Benjamin Netanyahu raised the issue during a visit by Secretary of State Mike Pompeo, whose agency no longer says the territory is “occupied.”","13","The New York Times","2019-03-20T21:56:57+0000","article","Foreign","World","Middle East","News","5c92b78349f0eacbf105e274",1001,0,"nyt://article/db7c6a94-52ff-5381-98b0-ef61ef960f47","Netanyahu Presses Pompeo on Israeli Sovereignty of Golan Heights",NA,NA,"Netanyahu Presses U.S. to Recognize Israeli Sovereignty in the Golan Heights",NA,NA,NA,"By EDWARD WONG",NA
"88","https://www.nytimes.com/2019/03/20/opinion/climate-building-codes.html","Local officials across the country will have a chance to vote on new energy efficiency standards for buildings. But few tend to vote, which could put the outcome in jeopardy.","Local officials across the country will have a chance to vote on new energy efficiency standards for buildings. But few tend to vote, which could put the outcome in jeopardy.",NA,"The New York Times","2019-03-20T19:00:04+0000","article","OpEd","Opinion",NA,"Op-Ed","5c928e0e49f0eacbf105e204",982,0,"nyt://article/96fa7f44-06a3-5a44-bd42-d9c8380d56ec","An Important Vote for the Climate",NA,NA,"An Important Vote for the Climate",NA,NA,NA,"By JUSTIN GILLIS",NA
"89","https://www.nytimes.com/2019/03/19/climate/colorado-river-water.html","Seven states, including California and Arizona, agreed to voluntarily cut their water use. But as the climate warms, any victory may be short-lived.","Seven states, including California and Arizona, agreed to voluntarily cut their water use. But as the climate warms, any victory may be short-lived.","18","The New York Times","2019-03-19T23:28:31+0000","article","Climate","Climate",NA,"News","5c917b7949f0eacbf105df48",1011,0,"nyt://article/7b65065f-9096-52a4-af28-18f9483a5087","Amid 19-Year Drought, States Sign Deal to Conserve Colorado River Water",NA,NA,"Seven States Sign Deal in Effort to Avert Water Crisis Along Colorado River",NA,NA,NA,"By JOHN SCHWARTZ",NA
"90","https://www.nytimes.com/2019/03/20/well/family/states-seek-financial-relief-for-family-caregivers.html","Lawmakers in California and at least seven other states want to provide state income tax credits for families that need help with home caregiving.","Lawmakers in California and at least seven other states want to provide state income tax credits for families that need help with home caregiving.",NA,"The New York Times","2019-03-20T09:00:01+0000","article","Well","Well","Family","News","5c92016c49f0eacbf105e03b",1086,0,"nyt://article/19ab1bb5-9904-563e-8df2-4abd253aad09","States Seek Financial Relief for Family Caregivers",NA,NA,"States Seek Financial Relief for Family Caregivers",NA,NA,NA,"By SAMANTHA YOUNG, KAISER HEALTH NEWS",NA
"91","https://www.nytimes.com/2019/03/19/travel/anniversaries-in-wyoming-and-huntsville-alabama.html","Huntsville, Alabama and the state of Wyoming are both gearing up to mark major milestones, but where one is an outright celebration, the other is a call to action.","Huntsville, Alabama and the state of Wyoming are both gearing up to mark major milestones, but where one is an outright celebration, the other is a call to action.","3","The New York Times","2019-03-19T09:00:19+0000","article","Travel","Travel",NA,"News","5c90affd49f0eacbf105dcd7",2431,0,"nyt://article/bb4f933d-85fe-5fc5-89e3-194d318b4e5a","In Praise of Pioneer Women and Rocket Scientists","The 52 Places Traveler","The 52 Places Traveler","In Praise of Pioneer Women and Rocket Scientists",NA,NA,NA,"By SEBASTIAN MODAK",NA
"92","https://www.nytimes.com/2019/03/20/fashion/tom-ford-melania-cfda.html","The new chairman of the Council of Fashion Designers of America never said that thing about Melania Trump — and says American designers must look outward.","The new chairman of the Council of Fashion Designers of America never said that thing about Melania Trump — and says American designers must look outward.","2","The New York Times","2019-03-20T12:07:18+0000","article","Styles","Fashion",NA,"News","5c922d5049f0eacbf105e0d9",1114,0,"nyt://article/ca110b11-e09b-5eac-b779-bb34b826363f","Tom Ford on Melania Trump (and the Future of American Fashion)","On the Runway","On the Runway","Tom Ford Heeds a Call to Duty",NA,NA,NA,"By VANESSA FRIEDMAN",NA
"93","https://www.nytimes.com/2019/03/19/crosswords/daily-puzzle-2019-03-20.html","Erik Agard, Amanda Chung and Karl Ni play hide-and-seek with us.","Erik Agard, Amanda Chung and Karl Ni play hide-and-seek with us.",NA,"The New York Times","2019-03-20T02:00:04+0000","article","Games","Crosswords & Games",NA,"News","5c919eff49f0eacbf105df7d",1087,0,"nyt://article/f5852c59-0738-5cb3-801b-c601445cfd91","Liquid","Wordplay","Wordplay","Liquid",NA,NA,NA,"By DEB AMLEN",NA
"94","https://www.nytimes.com/2019/03/19/arts/design/cortis-sonderegger-co-berlin-double-take-icons.html","The Swiss artists Jojakim Cortis and Adrian Sonderegger recreate famous historical photos in their studio, to remind us we shouldn’t always believe what we see.","The Swiss artists Jojakim Cortis and Adrian Sonderegger recreate famous historical photos in their studio, to remind us we shouldn’t always believe what we see.",NA,"The New York Times","2019-03-19T11:32:18+0000","article","Culture","Arts","Art & Design","News","5c90d39c49f0eacbf105dd4d",1121,0,"nyt://article/f25af282-7109-54d7-a24a-fc95b2bbbd4d","Think You Know This Photograph? Take Another Look",NA,NA,"Think You Know This Photograph? Take Another Look",NA,NA,NA,"By JOSIE THADDEUS-JOHNS",NA
"95","https://www.nytimes.com/2019/03/20/climate/wyoming-climate-change-drilling-interior.html","The decision could present a threat to President Trump’s agenda to quickly expand oil and gas drilling by offering opponents a roadmap to legal challenges. ","The decision could present a threat to President Trump’s agenda to quickly expand oil and gas drilling by offering opponents a roadmap to legal challenges. ","18","The New York Times","2019-03-20T18:22:55+0000","article","Climate","Climate",NA,"News","5c92855949f0eacbf105e1f5",659,0,"nyt://article/d01cb982-c98c-5369-aa89-49d6663d061e","Obama-Era Oil Leases Broke the Law by Not Assessing Climate Impact, Judge Rules",NA,NA,"Obama-Era Oil Leases Are Ruled Illegal, and That Might Pose a Problem for Trump",NA,NA,NA,"By CORAL DAVENPORT",NA
"96","https://www.nytimes.com/2019/03/20/reader-center/investigations-explainer.html","Rebecca Corbett and Dean Murphy, who lead our investigations team, answer questions about how they decide which projects to pursue, where they get tips and whether their jobs are as thrilling as the movies make them out to be.","Rebecca Corbett and Dean Murphy, who lead our investigations team, answer questions about how they decide which projects to pursue, where they get tips and whether their jobs are as thrilling as the movies make them out to be.","2","The New York Times","2019-03-20T09:00:08+0000","article","NewsDesk","Reader Center",NA,"News","5c92017349f0eacbf105e044",1569,0,"nyt://article/1597540b-022e-51c3-97b4-02c75a89dd05","How The Times Decides What to Investigate","Understanding The Times","Understanding The Times","How We Decide What to Investigate",NA,NA,NA,"By KATIE VAN SYCKLE",NA
"97","https://www.nytimes.com/2019/03/19/opinion/brazil-rain-forest.html","Indigenous leaders battle to save their land and their way of life.","Indigenous leaders battle to save their land and their way of life.","26","The New York Times","2019-03-19T10:00:04+0000","article","Editorial","Opinion",NA,"Editorial","5c90bdff49f0eacbf105dd0a",806,0,"nyt://article/b063fc7a-f5fd-529a-b81e-c9ae8a164402","Brazil’s New President Threatens ‘the Lungs of the Planet’","Editorial Observer","Editorial Observer","Who Will Save the Rain Forest?",NA,NA,NA,"By CAROL GIACOMO",NA
"98","https://www.nytimes.com/2019/03/20/arts/television/dave-attell.html","He’s an old-school performer who specializes in hard-hitting punch lines and isn’t interested in fighting culture wars. That makes him a rarity in comedy today.","He’s an old-school performer who specializes in hard-hitting punch lines and isn’t interested in fighting culture wars. That makes him a rarity in comedy today.","1","The New York Times","2019-03-20T17:43:45+0000","article","Culture","Arts","Television","News","5c927c2b49f0eacbf105e1de",1077,0,"nyt://article/00caf4dc-1a89-590b-80c0-22b16edc59d5","Dave Attell Is Our Greatest Club Comic (Says the Writer He Made Fun Of)","On Comedy","On Comedy","Ruthless. Seasoned. Hilarious.",NA,NA,NA,"By JASON ZINOMAN",NA
"99","https://www.nytimes.com/2019/03/20/arts/design/jews-money-myth-antisemitism-exhibition-london.html","An exhibition at the Jewish Museum in London looks at 2,000 years of negative stereotypes through historical objects and works of art.","An exhibition at the Jewish Museum in London looks at 2,000 years of negative stereotypes through historical objects and works of art.","1","The New York Times","2019-03-20T17:46:29+0000","article","Culture","Arts","Art & Design","News","5c927ccf49f0eacbf105e1e0",1244,0,"nyt://article/79964d0a-4837-5cdc-ab11-16117e409130","A Museum Tackles Myths About Jews and Money",NA,NA,"Debunking Myths About Jews and Money",NA,NA,NA,"By FARAH NAYERI",NA
"100","https://www.nytimes.com/2019/03/20/crosswords/who-made-my-puzzle-vigeland.html","This month’s constructor spotlight shines on Finn Vigeland.","This month’s constructor spotlight shines on Finn Vigeland.",NA,"The New York Times","2019-03-20T10:00:00+0000","article","Games","Crosswords & Games",NA,"News","5c920f7c49f0eacbf105e07d",1153,0,"nyt://article/bb7aa166-eb7e-5e4b-9e00-2a18cb8d3c98","Who Made My Puzzle?","Wordplay","Wordplay","Who Made My Puzzle?",NA,NA,NA,"By DEB AMLEN",NA
"101","https://www.nytimes.com/2019/03/20/books/review/survival-math-mitchell-s-jackson.html","In “Survival Math,” Mitchell S. Jackson tells his family story of living in Oregon and reckons with the interplay of racism and patriarchy in his own life.","In “Survival Math,” Mitchell S. Jackson tells his family story of living in Oregon and reckons with the interplay of racism and patriarchy in his own life.","18","The New York Times","2019-03-20T09:00:09+0000","article","BookReview","Books","Book Review","Review","5c92017449f0eacbf105e046",1189,0,"nyt://article/6f2cbb83-f746-5b2b-9081-24b0df38cdeb","A Memoir of Black Life in the ‘Other America’","Nonfiction","Nonfiction","Brother’s Keeper",NA,NA,NA,"By DARNELL L. MOORE",NA
"102","https://www.nytimes.com/2019/03/20/magazine/ocasio-cortez-is-finding-a-new-model-for-how-to-work-in-public.html","Why try to “rise above” preconceived notions about you when you can harness them?","Why try to “rise above” preconceived notions about you when you can harness them?","19","The New York Times","2019-03-20T09:00:10+0000","article","Magazine","Magazine",NA,"News","5c92017449f0eacbf105e048",1205,0,"nyt://article/b9efd5e3-1457-517c-9454-24abd31c8ea5","Ocasio-Cortez Is Finding a New Model for How to Work in Public","Screenland","Screenland","Long Game",NA,NA,NA,"By CARINA CHOCANO",NA
"103","https://www.nytimes.com/2019/03/20/fashion/watches-vacheron-constantin.html","Louis Ferla, the watch house’s chief executive, stresses the individuality of his work force.","Louis Ferla, the watch house’s chief executive, stresses the individuality of his work force.",NA,"International New York Times","2019-03-20T05:05:04+0000","article","SpecialSections","Fashion",NA,"News","5c91ca5a49f0eacbf105dfc4",1132,0,"nyt://article/2c2e7fc8-8635-51c2-8c3d-223e69f4b061","Vacheron Constantin and ‘The Human Touch’",NA,NA,"The human touch",NA,NA,NA,"By ROBIN SWITHINBANK",NA
"104","https://www.nytimes.com/2019/03/19/opinion/nicholas-christakis-yale.html","How a target of students’ ire came to write a book about humanity’s transcendent goodness.","How a target of students’ ire came to write a book about humanity’s transcendent goodness.","27","The New York Times","2019-03-19T23:01:05+0000","article","OpEd","Opinion",NA,"Op-Ed","5c91750c49f0eacbf105df39",1157,0,"nyt://article/5ca62b27-9a58-5f62-a5b7-f3048ba235fc","A ‘Disgusting’ Yale Professor Moves On",NA,NA,"A ‘Disgusting’ Yale Professor Moves On",NA,NA,NA,"By FRANK BRUNI",NA
"105","https://www.nytimes.com/2019/03/19/us/california-today-uc-irvine-ncaa-tournament.html","Tuesday: U.C. Irvine has become a hot N.C.A.A. tournament pick; the military construction projects that could be raided to fund Trump’s wall; and a lawsuit over the Flintstone House in Hillsborough.","Tuesday: U.C. Irvine has become a hot N.C.A.A. tournament pick; the military construction projects that could be raided to fund Trump’s wall; and a lawsuit over the Flintstone House in Hillsborough.",NA,"The New York Times","2019-03-19T13:05:23+0000","article","National","U.S.",NA,"briefing","5c90e96d49f0eacbf105dd74",1192,0,"nyt://article/f50b6f53-0a4c-54da-9e84-299250762271","The Best College Basketball Team in California Probably Isn’t the One You Think","California Today","California Today","",NA,NA,NA,"By MATT STEVENS",NA
"106","https://www.nytimes.com/2019/03/19/arts/dance/married-angel-balanchine-ballet.html","The wife-and-husband team of Sara Mearns and Joshua Bergasse talk about working together on “I Married an Angel” for Encores! Reader, she Lindy Hops.","The wife-and-husband team of Sara Mearns and Joshua Bergasse talk about working together on “I Married an Angel” for Encores! Reader, she Lindy Hops.","1","The New York Times","2019-03-19T16:47:01+0000","article","Culture","Arts","Dance","News","5c911d5f49f0eacbf105de24",1225,0,"nyt://article/2be1efb5-cab2-57ba-8159-777f6bdc112d","She Dances. He Directs. How They Created a Balletic Battle of the Sexes.",NA,NA,"She Dances. He Directs. It’s Surreal.",NA,NA,NA,"By GIA KOURLAS",NA
"107","https://www.nytimes.com/2019/03/19/nyregion/michael-cohen-documents-trump.html","The records, released on Tuesday, indicate that Mr. Cohen, President Trump’s former lawyer, came under scrutiny much earlier than was previously known.","The records, released on Tuesday, indicate that Mr. Cohen, President Trump’s former lawyer, came under scrutiny much earlier than was previously known.","18","The New York Times","2019-03-19T13:23:59+0000","article","Metro","New York",NA,"News","5c90edc949f0eacbf105dd84",839,0,"nyt://article/f74df2f8-2c50-5d09-9c50-307a3f4c1b77","Special Counsel Sought Michael Cohen’s Emails in 2017, Documents Show",NA,NA,"Scrutiny Started in 2017 For Trump’s Former Fixer",NA,NA,NA,"By BENJAMIN WEISER and WILLIAM K. RASHBAUM",NA
"108","https://www.nytimes.com/2019/03/20/obituaries/barbara-hammer-dead.html","After Ms. Hammer came out in the 1970s, her films took a provocative and influential turn. “One of my goals,” she said, “was to put a lesbian on camera.”","After Ms. Hammer came out in the 1970s, her films took a provocative and influential turn. “One of my goals,” she said, “was to put a lesbian on camera.”","14","The New York Times","2019-03-20T19:25:14+0000","article","Obits","Obituaries",NA,"Obituary (Obit)","5c9293f449f0eacbf105e213",1219,0,"nyt://article/525f198c-1ecf-581e-821a-ce4c230c717e","Barbara Hammer, Filmmaker of Lesbian Sexuality, Dies at 79",NA,NA,"Barbara Hammer, Whose Films Explored Lesbian Sexuality, Dies at 79",NA,NA,NA,"By RICHARD SANDOMIR",NA
"109","https://www.nytimes.com/2019/03/20/business/google-fine-advertising.html","The antitrust fine, the third imposed on Google by the European Union since 2017, reinforces Europe’s regulatory role as the world’s most aggressive tech watchdog.","The antitrust fine, the third imposed on Google by the European Union since 2017, reinforces Europe’s regulatory role as the world’s most aggressive tech watchdog.","1","The New York Times","2019-03-20T11:08:18+0000","article","Business","Business",NA,"News","5c921f7c49f0eacbf105e0ac",1250,0,"nyt://article/92737546-da2d-50e8-b2b8-3e8b59e37165","Google Fined $1.7 Billion by E.U. for Unfair Advertising Rules",NA,NA,"Google Fined $1.7 Billion By E.U. for Ad Practices",NA,NA,NA,"By ADAM SATARIANO",NA
